{
  "id": "ext_010",
  "track": "conversation_extraction",
  "family": "application_filling",
  "split": "optimization",
  "scenario_group": "landlord_requirement_not_customer_selection",
  "difficulty": "challenging",
  "input": {
    "as_of": "2026-10-08",
    "instruction": "Complete the renters insurance application draft from this chat. Include every declared field. Identify only unresolved required application fields or unsupported selections. Do not submit, bind, or change insurance.",
    "session": {
      "verified": false,
      "role": "visitor",
      "policy_id": null
    },
    "records": [],
    "messages": [
      {
        "id": "m1",
        "role": "customer",
        "text": "Dev Malik here, dev.malik@example.test. I rent 61 Lantern Court, Unit 6, Pine Harbor from Crescent Homes. Their office email is leasing@crescent.example.test."
      },
      {
        "id": "m2",
        "role": "bot",
        "text": "What does the lease require for liability, and what would you like to apply for?"
      },
      {
        "id": "m3",
        "role": "customer",
        "text": "The lease says at least $100,000. I select $300,000 liability and $30,000 property, with $250 deductible."
      },
      {
        "id": "m4",
        "role": "bot",
        "text": "Should I use the leasing email as the applicant contact and the lease minimum as your selection?"
      },
      {
        "id": "m5",
        "role": "customer",
        "text": "No. Use my email. Crescent Homes is only an interested party for notices. Occupancy and insurance should both begin November 3, 2026."
      },
      {
        "id": "m6",
        "role": "bot",
        "text": "Do you consent to submit this application, and may notices go to that office email?"
      },
      {
        "id": "m7",
        "role": "customer",
        "text": "Yes to both: submit my application and send the interested-party notices to leasing@crescent.example.test."
      }
    ],
    "form": {
      "applicant_name": {
        "type": "string",
        "nullable": true,
        "description": "Applicant full name as explicitly given, preserving spelling."
      },
      "contact_email": {
        "type": "string",
        "nullable": true,
        "description": "Applicant contact email; do not substitute a landlord or another occupant email."
      },
      "insured_address": {
        "type": "string",
        "nullable": true,
        "description": "Complete requested insured dwelling address including unit; null if no single complete address is established. Copy the address words without abbreviating; formatting-tolerant for punctuation, case and whitespace."
      },
      "occupancy_start": {
        "type": "string",
        "nullable": true,
        "description": "Date applicant starts occupying the dwelling, ISO YYYY-MM-DD; null if unresolved."
      },
      "requested_start": {
        "type": "string",
        "nullable": true,
        "description": "Explicitly requested insurance start date, ISO YYYY-MM-DD; separate from occupancy date."
      },
      "personal_property_limit": {
        "type": "integer",
        "nullable": true,
        "description": "Explicit selected personal-property limit in USD; retain unsupported requested numeric options and flag for clarification."
      },
      "liability_limit": {
        "type": "integer",
        "nullable": true,
        "description": "Explicit selected liability limit in USD; null when unselected."
      },
      "deductible": {
        "type": "integer",
        "nullable": true,
        "description": "Explicit selected deductible in USD; null when unselected."
      },
      "consent_to_submit": {
        "type": "boolean",
        "nullable": true,
        "description": "True only for explicit application submission consent, false for explicit decline, otherwise null."
      },
      "interested_party_name": {
        "type": "string",
        "nullable": true,
        "description": "Explicit notice recipient organization name, if requested."
      },
      "interested_party_email": {
        "type": "string",
        "nullable": true,
        "description": "Explicitly authorized notice recipient email."
      }
    },
    "allowed_actions": []
  }
}
