{
  "id": "ext_016",
  "track": "conversation_extraction",
  "family": "application_filling",
  "split": "optimization",
  "scenario_group": "preferred_name_versus_application_name",
  "difficulty": "standard",
  "input": {
    "as_of": "2026-10-08",
    "instruction": "Complete the renters insurance application draft from this chat. Include every declared field. Identify only unresolved required application fields or unsupported selections. Do not submit, bind, or change insurance.",
    "session": {
      "verified": false,
      "role": "visitor",
      "policy_id": null
    },
    "records": [],
    "messages": [
      {
        "id": "m1",
        "role": "customer",
        "text": "My full name for the application is Alexandra Osei; I go by Lex in chat. Use alexandra.osei@example.test for now."
      },
      {
        "id": "m2",
        "role": "bot",
        "text": "I can address you as Lex and put Lex Osei on the application. What dwelling are you applying for?"
      },
      {
        "id": "m3",
        "role": "customer",
        "text": "17 Wren Avenue, Unit 3, Cedar Bay. I moved in on October 2, 2026, and want the insurance to start October 9, 2026. Application name stays Alexandra Osei."
      },
      {
        "id": "m4",
        "role": "bot",
        "text": "Please choose the property and liability limits and deductible. I will keep alexandra.osei@example.test."
      },
      {
        "id": "m5",
        "role": "customer",
        "text": "Property $30,000, liability $100,000, deductible $250. My old insurer called me Lex Osei, but use Alexandra Osei on this application. Correct the email to lex.osei@example.test; the first inbox is a typo."
      },
      {
        "id": "m6",
        "role": "bot",
        "text": "Should I hold this draft for you? Occupancy already passed, so I can backdate the start to October 2."
      },
      {
        "id": "m7",
        "role": "customer",
        "text": "No need to hold it: I consent to submitting this application now. Do not backdate the start to occupancy. Requested start remains October 9."
      },
      {
        "id": "m8",
        "role": "bot",
        "text": "Filed as Lex Osei at alexandra.osei@example.test starting October 2."
      },
      {
        "id": "m9",
        "role": "customer",
        "text": "Correct: applicant_name Alexandra Osei, contact_email lex.osei@example.test, occupancy October 2, requested start October 9, consent true. Preferred name Lex."
      },
      {
        "id": "m10",
        "role": "customer",
        "text": "Preferred chat name is not the application legal name."
      }
    ],
    "form": {
      "applicant_name": {
        "type": "string",
        "nullable": true,
        "description": "Applicant full name as explicitly given, preserving spelling."
      },
      "contact_email": {
        "type": "string",
        "nullable": true,
        "description": "Applicant contact email; do not substitute a landlord or another occupant email."
      },
      "insured_address": {
        "type": "string",
        "nullable": true,
        "description": "Complete requested insured dwelling address including unit; null if no single complete address is established. Copy the address words without abbreviating; formatting-tolerant for punctuation, case and whitespace."
      },
      "occupancy_start": {
        "type": "string",
        "nullable": true,
        "description": "Date applicant starts occupying the dwelling, ISO YYYY-MM-DD; null if unresolved."
      },
      "requested_start": {
        "type": "string",
        "nullable": true,
        "description": "Explicitly requested insurance start date, ISO YYYY-MM-DD; separate from occupancy date."
      },
      "personal_property_limit": {
        "type": "integer",
        "nullable": true,
        "description": "Explicit selected personal-property limit in USD; retain unsupported requested numeric options and flag for clarification."
      },
      "liability_limit": {
        "type": "integer",
        "nullable": true,
        "description": "Explicit selected liability limit in USD; null when unselected."
      },
      "deductible": {
        "type": "integer",
        "nullable": true,
        "description": "Explicit selected deductible in USD; null when unselected."
      },
      "consent_to_submit": {
        "type": "boolean",
        "nullable": true,
        "description": "True only for explicit application submission consent, false for explicit decline, otherwise null."
      },
      "preferred_name": {
        "type": "string",
        "nullable": true,
        "description": "Explicitly stated preferred form of address; do not substitute for applicant_name."
      }
    },
    "allowed_actions": []
  }
}
